shop_name,listing_id,title,tags,image_1,etsy_url,review_count,last_review_date
GONdesignJEWELRY,1737059973,"Custom puzzle cartoon character, Kids puzzle custom, Bandit father day jigsaw puzzle bluey themed for fathers gift, Personalize Bluey puzzle",,https://i.etsystatic.com/6017009726/r/il/149f8b/6017009726/il_340x270.6017009726_r38r.jpg,https://www.etsy.com/listing/1737059973/custom-puzzle-cartoon-character-kids?ref=shop_review,1.0,2024-06-09
GONdesignJEWELRY,1681972920,Custom Converse Chuck Taylor 1970s Embroidery Logo • Converse personal shoes • Vietnamese handmade shoe • handmade embroidered • custom vans,,https://i.etsystatic.com/5898674615/r/il/184d63/5898674615/il_340x270.5898674615_lidk.jpg,https://www.etsy.com/listing/1681972920/custom-converse-chuck-taylor-1970s?ref=shop_review,1.0,2024-05-04
GONdesignJEWELRY,1471895553,"Personalized Rattan Basket Doll House, Unique Wicker Miniature Dollhouse, Custom Kids Rattan Small Shoulder Bags Gift, Baby Nursery Decor",,https://i.etsystatic.com/5695160118/r/il/ac332c/5695160118/il_340x270.5695160118_4bjx.jpg,https://www.etsy.com/listing/1471895553/personalized-rattan-basket-doll-house?ref=shop_review,1.0,2024-03-16
GONdesignJEWELRY,1457702844,"Custom name pink rattan house shoulder bag, unique doll house rattan bag, Kids rattan shoulder bags, Baby nursery decor, rattan kids gift",,https://i.etsystatic.com/4862462458/r/il/cb8cb0/4862462458/il_340x270.4862462458_ev23.jpg,https://www.etsy.com/listing/1457702844/custom-name-pink-rattan-house-shoulder?ref=shop_review,1.0,2024-03-01
GONdesignJEWELRY,1457691782,"Big size- Custom name rattan house bag, unique doll house rattan bag, Kids rattan shoulder bags, Baby nursery decor, rattan kids gift",,https://i.etsystatic.com/4862352840/r/il/1a6b56/4862352840/il_340x270.4862352840_l48h.jpg,https://www.etsy.com/listing/1457691782/big-size-custom-name-rattan-house-bag?ref=shop_review,15.0,2024-02-10
GONdesignJEWELRY,1457713072,"PERSONALISED NAME Big Size Rattan mushroom house bags, Rattan Fairy House, Wicker Mushroom Doll House. Perfect Nursery/kids gift",,https://i.etsystatic.com/4910763469/r/il/b8f56f/4910763469/il_340x270.4910763469_orv0.jpg,https://www.etsy.com/listing/1457713072/personalised-name-big-size-rattan?ref=shop_review,2.0,2024-01-17
GONdesignJEWELRY,1471898739,"Custom name rattan house shoulder  bag, unique doll house rattan bag, Kids rattan shoulder bags, rattan kids gift",,https://i.etsystatic.com/4910613175/r/il/f3dece/4910613175/il_340x270.4910613175_6kl0.jpg,https://www.etsy.com/listing/1471898739/custom-name-rattan-house-shoulder-bag?ref=shop_review,4.0,2023-12-19
GONdesignJEWELRY,1471913323,"Custom name Big Size Rattan mushroom house bags, Rattan Fairy House, Wicker Mushroom Doll House. Perfect Nursery/kids gift",,https://i.etsystatic.com/4910774263/r/il/43b64b/4910774263/il_340x270.4910774263_4sdq.jpg,https://www.etsy.com/listing/1471913323/personalized-big-size-rattan-mushroom?ref=shop_review,6.0,2023-12-18
GONdesignJEWELRY,1324507635,"500  Color Fans lashes Premade, Volume Fans Eyelash Extensions C, CC, D Curl Russian Handmade Promade Fans, 6D, 8D lash",,https://i.etsystatic.com/4248613384/r/il/4b0017/4248613384/il_340x270.4248613384_ckp8.jpg,https://www.etsy.com/listing/1324507635/500-color-fans-lashes-premade-volume?ref=shop_review,1.0,2023-04-10
GONdesignJEWELRY,1085948738,"SET OF 2 wall hanging rattan onion basket, farm house garlic hanger, egg baskets, kitchen wall decor basket for a rustic kitchen space",,https://i.etsystatic.com/3388040956/r/il/d20742/3388040956/il_340x270.3388040956_ig8x.jpg,https://www.etsy.com/listing/1085948738/set-of-2-wall-hanging-rattan-onion?ref=shop_review,22.0,2022-04-12
GONdesignJEWELRY,1086673952,"Set of 3 rattan  wall basket decor, african woven basket set, bohemian wall decor, wall decor boho style",,https://i.etsystatic.com/3438166913/r/il/581c6e/3438166913/il_340x270.3438166913_w0lf.jpg,https://www.etsy.com/listing/1086673952/set-of-3-rattan-wall-basket-decor?ref=shop_review,6.0,2022-03-13
GONdesignJEWELRY,1100022607,"Rattan wall hanging baskets for organizing, wall hanging planter holder,  wall planter indoor, kitchen wall decor farmhouse",,https://i.etsystatic.com/3435626909/r/il/d6a21b/3435626909/il_340x270.3435626909_5mf2.jpg,https://www.etsy.com/listing/1100022607/rattan-wall-hanging-baskets-for?ref=shop_review,3.0,2022-01-25
GONdesignJEWELRY,1037543201,"Set of 2 Boho Wall Basket Decor, Hanging Woven Wall Basket, Baskets For Shelves, Fruit Basket For Kitchen, Wicker Round Serving Tray",,https://i.etsystatic.com/3151546384/r/il/362c97/3151546384/il_340x270.3151546384_nnv5.jpg,https://www.etsy.com/listing/1037543201/set-of-2-boho-wall-basket-decor-hanging?ref=shop_review,1.0,2022-01-05
GONdesignJEWELRY,1066653677,"SET OF 6 rattan leaf shape placemat, rattan wicker placemat, woven boho charger place for dining table",,https://i.etsystatic.com/3260585978/r/il/4b15ce/3260585978/il_340x270.3260585978_tbi4.jpg,https://www.etsy.com/listing/1066653677/set-of-6-rattan-leaf-shape-placemat?ref=shop_review,3.0,2021-12-22
GONdesignJEWELRY,1039389768,"Set of 3 13.5"" Wall Hanging Basket, Large Macrame Wall Hanging, Woven Wall Hanging Decor, Wall Hanging Fruit Basket",,https://i.etsystatic.com/3332357416/r/il/069595/3332357416/il_340x270.3332357416_jko0.jpg,https://www.etsy.com/listing/1039389768/set-of-3-135-wall-hanging-basket-large?ref=shop_review,1.0,2021-12-15
GONdesignJEWELRY,1039388594,"Set of 3 13.5"" Wall Hanging Basket, Large Macrame Wall Hanging, Woven Wall Hanging Decor, Wall Hanging Fruit Basket",,https://i.etsystatic.com/3380051073/r/il/b9d457/3380051073/il_340x270.3380051073_c7y5.jpg,https://www.etsy.com/listing/1039388594/set-of-3-135-wall-hanging-basket-large?ref=shop_review,2.0,2021-12-07
GONdesignJEWELRY,1037539365,"Rattan Round Side Table, Side Table Living Room, Accent Table Lamp, perfect nightstand for any space",,https://i.etsystatic.com/3151526978/r/il/87a077/3151526978/il_340x270.3151526978_tgkd.jpg,https://www.etsy.com/listing/1037539365/rattan-round-side-table-side-table?ref=shop_review,5.0,2021-10-09
GONdesignJEWELRY,4304161995,"Anti Social Book Club Shirt Comfort Colors, Romance Reader Tshirt, Anti Social Reader, Introverted Reader Tee, Bookish Shirt For Book Lover",,https://i.etsystatic.com/6903717149/r/il/f8fb2c/6903717149/il_340x270.6903717149_5wiy.jpg,https://www.etsy.com/listing/4304161995/anti-social-book-club-shirt-comfort?ref=shop_review,9.0,2025-09-05
GONdesignJEWELRY,4356499798,"ACOTAR Velaris Art Festival Comfort Colors Shirt, The Night Court Inspired T Shirt, SJM City Of Stars Tee, Feyre Rhysand Book Lover",,https://i.etsystatic.com/7179112103/r/il/502615/7179112103/il_340x270.7179112103_1xhm.jpg,https://www.etsy.com/listing/4356499798/acotar-velaris-art-festival-comfort?ref=shop_review,1.0,2025-09-05
GONdesignJEWELRY,1826335325,"Wizard Movie Fan Emerald City Comfort Colors Shirt, Wicked Change For Good T Shirt, Wizard University Tee, Gift For Fan",,https://i.etsystatic.com/6597556659/r/il/64f315/6597556659/il_340x270.6597556659_k1jf.jpg,https://www.etsy.com/listing/1826335325/wizard-movie-fan-emerald-city-comfort?ref=shop_review,17.0,2025-09-04
GONdesignJEWELRY,1884023784,"Powerless Bookish Comfort Colors Shirt For Fan, Kai Azer I Love You TShirt, Fearless Fan Shirt, Gift for Bookworms, Romantic Quotes",,https://i.etsystatic.com/6815056717/r/il/5f9325/6815056717/il_340x270.6815056717_gd7r.jpg,https://www.etsy.com/listing/1884023784/powerless-bookish-comfort-colors-shirt?ref=shop_review,7.0,2025-09-04
GONdesignJEWELRY,1888652004,"Wishing Well Ranch Comfort Colors Shirt, Chestnut Springs Cowboy Romance T Shirt, Bookish Cowgirl Tee, Bookish Gift For Her",,https://i.etsystatic.com/6790331656/r/il/a37442/6790331656/il_340x270.6790331656_t49q.jpg,https://www.etsy.com/listing/1888652004/wishing-well-ranch-comfort-colors-shirt?ref=shop_review,4.0,2025-09-04
GONdesignJEWELRY,4348443716,"Cozy Season Fall Bucket List Comfort Colors Shirt, Fall Vibes Long Sleeve, Pumpkin Lover TShirt, Women Thanksgiving Gift, Cute Autumn Tee",,https://i.etsystatic.com/7091197884/r/il/0e2b3d/7091197884/il_340x270.7091197884_4q0h.jpg,https://www.etsy.com/listing/4348443716/cozy-season-fall-bucket-list-comfort?ref=shop_review,1.0,2025-09-04
GONdesignJEWELRY,4338831295,"Emily Henry Books Stamp Tote Bag, Beach Read Canvas Bag, Happy Place Inspired Bag, Book Lovers Gift, Emily Henry Fan Merch",,https://i.etsystatic.com/7085973211/r/il/bcade0/7085973211/il_340x270.7085973211_kveh.jpg,https://www.etsy.com/listing/4338831295/emily-henry-books-stamp-tote-bag-beach?ref=shop_review,1.0,2025-09-03
GONdesignJEWELRY,4349998710,"Pottsfield Harvest Festival Shirt Comfort Colors Shirt, Pumpkin Village T Shirt, Vintage Cartoon Tee For Halloween Season, AutumnApparelGift",,https://i.etsystatic.com/7098729042/r/il/24ab4e/7098729042/il_340x270.7098729042_gifg.jpg,https://www.etsy.com/listing/4349998710/pottsfield-harvest-festival-shirt?ref=shop_review,2.0,2025-09-03
GONdesignJEWELRY,4351264385,"Halloween Tis the Season Comfort Colors Shirt, Spooky Season TShirt, Retro Halloween Aesthetic Shirt, Women's Halloween Shirt",,https://i.etsystatic.com/7152669247/r/il/ca0e88/7152669247/il_340x270.7152669247_al6m.jpg,https://www.etsy.com/listing/4351264385/halloween-tis-the-season-comfort-colors?ref=shop_review,1.0,2025-09-03
GONdesignJEWELRY,1784221139,"Salem Book Club Comfort Colors Shirt, Witches Reading T Shirt, Black Cat Spooky Halloween Tee, Gift For Reader",,https://i.etsystatic.com/6272272285/r/il/5b9ecd/6272272285/il_340x270.6272272285_6yzz.jpg,https://www.etsy.com/listing/1784221139/salem-book-club-comfort-colors-shirt?ref=shop_review,1.0,2025-09-02
GONdesignJEWELRY,4343127749,"Kuzco Poison Comfort Colors Shirt, Oh Right That Poison Llama Poison For Kuzco Shirt, Pick Your Poison Tee, The Emperor's New Groove TShirt",,https://i.etsystatic.com/7062200730/r/il/cbda2c/7062200730/il_340x270.7062200730_r6xs.jpg,https://www.etsy.com/listing/4343127749/kuzco-poison-comfort-colors-shirt-oh?ref=shop_review,3.0,2025-09-02
GONdesignJEWELRY,1831958423,"Support Your Local Library Sweatshirt, VSCO Librarian Crewneck, Bookworm Hoodie, Gift For Book Lover",,https://i.etsystatic.com/6506248071/r/il/3040ae/6506248071/il_340x270.6506248071_7p2i.jpg,https://www.etsy.com/listing/1831958423/support-your-local-library-sweatshirt?ref=shop_review,3.0,2025-09-01
GONdesignJEWELRY,4329090086,"Once Upon A Time Throne Of Glass Comfort Colors Shirt, Heir Of Fire TOG T Shirt, Aelin Galathynius Fire Heart Bookish TOG Tee, Bookish Gift",,https://i.etsystatic.com/6985826320/r/il/f6821e/6985826320/il_340x270.6985826320_enmz.jpg,https://www.etsy.com/listing/4329090086/once-upon-a-time-throne-of-glass-comfort?ref=shop_review,4.0,2025-09-01
GONdesignJEWELRY,1762772738,"Velaris The Night Court Acotar 2 Sided Comfort Colors Shirt, Velaris The Night Court Shirt, Court Of Dreams, Inner Circle Acotar Tee",,https://i.etsystatic.com/6191051472/r/il/55c9c1/6191051472/il_340x270.6191051472_9fhf.jpg,https://www.etsy.com/listing/1762772738/velaris-the-night-court-acotar-2-sided?ref=shop_review,130.0,2025-08-31
GONdesignJEWELRY,4354079224,"Nevermore Academy Comfort Colors Shirt, Addams Inspired Clothing, Gothic Fashion, Halloween Costume, Addams Family Apparel",,https://i.etsystatic.com/7166530429/r/il/fe871e/7166530429/il_340x270.7166530429_vk8p.jpg,https://www.etsy.com/listing/4354079224/nevermore-academy-comfort-colors-shirt?ref=shop_review,1.0,2025-08-31
GONdesignJEWELRY,4328550546,"Moonbeam Ice Cream Cookie Comfort Colors Shirt, American Music Tour 2025 T Shirt, Mystical Magical, Concer Tour Tee",,https://i.etsystatic.com/6982930684/r/il/bec016/6982930684/il_340x270.6982930684_oeh7.jpg,https://www.etsy.com/listing/4328550546/moonbeam-ice-cream-cookie-comfort-colors?ref=shop_review,3.0,2025-08-30
GONdesignJEWELRY,1851462715,"Funny LOTR Comfort Colors Shirt For Fans, Second Breakfast Shirt, Bookworm Apparel, Cozy Fantasy Tee, Gift For Book Lover",,https://i.etsystatic.com/6534471800/r/il/14691c/6534471800/il_340x270.6534471800_gz9x.jpg,https://www.etsy.com/listing/1851462715/funny-lotr-comfort-colors-shirt-for-fans?ref=shop_review,2.0,2025-08-30
GONdesignJEWELRY,1837263638,"Suriel Tea Co Comfort Colors Shirt, New Acotar TShirt, Velaris The Night Court Gift, ACOTAR Suriel Tea Co Shirt, SJM Merch",,https://i.etsystatic.com/6582586469/r/il/6b1003/6582586469/il_340x270.6582586469_ls00.jpg,https://www.etsy.com/listing/1837263638/suriel-tea-co-comfort-colors-shirt-new?ref=shop_review,8.0,2025-08-30
GONdesignJEWELRY,4354087667,"Dungeon Crawler Carl Shirt Comfort Colors, New Achievement T Shirt, Princess Donut & Mongo Tee, Bookish Graphic Sci-Fi Reader Gift",,https://i.etsystatic.com/7166499181/r/il/199cc8/7166499181/il_340x270.7166499181_hx2z.jpg,https://www.etsy.com/listing/4354087667/dungeon-crawler-carl-shirt-comfort?ref=shop_review,1.0,2025-08-29
GONdesignJEWELRY,4346152227,"Summer I Turned Pretty 2 Sided Comfort Color Shirt, Team Conrad Team Jeremiah, Cousins Beach Tee, Summer Vibes, Bookish Merch",,https://i.etsystatic.com/7079156570/r/il/9aebf6/7079156570/il_340x270.7079156570_63li.jpg,https://www.etsy.com/listing/4346152227/summer-i-turned-pretty-2-sided-comfort?ref=shop_review,2.0,2025-08-29
GONdesignJEWELRY,1869211009,"Fourth Wing Series Mug For Fans, War College Ceramic Mug, Dragon Rider Bookish Coffee Mug, Book Lover Gift",,https://i.etsystatic.com/6667512063/r/il/145178/6667512063/il_340x270.6667512063_b8p4.jpg,https://www.etsy.com/listing/1869211009/fourth-wing-series-mug-for-fans-war?ref=shop_review,1.0,2025-08-29
GONdesignJEWELRY,1788817387,"Custom ACOTAR Fan Comfort Colors Shirt, Mist And Fury Book T Shirt, Girl Reading Book Graphic Tee, Gift For Book Lover",,https://i.etsystatic.com/6295165307/r/il/d2aa7e/6295165307/il_340x270.6295165307_lzx3.jpg,https://www.etsy.com/listing/1788817387/custom-acotar-fan-comfort-colors-shirt?ref=shop_review,1.0,2025-08-28
GONdesignJEWELRY,1819967338,"Funny Astarion Game Fan Sweatshirt, You’re Not Alone Crewneck, Astarion BG3 Shirts, High Elf Gaming Apparel, Dark Humor Tee",,https://i.etsystatic.com/6468365712/r/il/71d2be/6468365712/il_340x270.6468365712_r432.jpg,https://www.etsy.com/listing/1819967338/funny-astarion-game-fan-sweatshirt-youre?ref=shop_review,3.0,2025-08-28
GONdesignJEWELRY,1890471281,"Gay The Pray Away Comfort Colors Shirt, Retro Gay Frog Shirt, Funny Gay Saying Shirt, Cottagecore Frog And Toad Shirt, Queer TShirt",,https://i.etsystatic.com/6775444511/r/il/bc43b7/6775444511/il_340x270.6775444511_52cs.jpg,https://www.etsy.com/listing/1890471281/gay-the-pray-away-comfort-colors-shirt?ref=shop_review,12.0,2025-08-27
GONdesignJEWELRY,1834446532,"Kai Azer I Love You In Powerless Comfort Colors Shirt, Kai Azer Powerless Shirt, Kai And Paedyn Shirt, Valentine Gift Shirt, Powerless Shirt",,https://i.etsystatic.com/6582360066/r/il/a5d3cb/6582360066/il_340x270.6582360066_4a4b.jpg,https://www.etsy.com/listing/1834446532/kai-azer-i-love-you-in-powerless-comfort?ref=shop_review,12.0,2025-08-27
GONdesignJEWELRY,1904859467,"Princess Donut Comfort Colors Shirt, Dungeon Crawler Carl TShirt, Sci-Fi Book Lover Tee, Bookish Apparel for Book Lovers",,https://i.etsystatic.com/6848334313/r/il/03cc8a/6848334313/il_340x270.6848334313_aqj2.jpg,https://www.etsy.com/listing/1904859467/princess-donut-comfort-colors-shirt?ref=shop_review,9.0,2025-08-26
GONdesignJEWELRY,1753983331,"Dragon Book Comfort Colors Shirt, Bookworm Book Dragon Sweatshirt, Easily Distracted By Dragons And Books Shirts,Dragon Rider Fan Merch",,https://i.etsystatic.com/6089318970/r/il/105dce/6089318970/il_340x270.6089318970_qlc3.jpg,https://www.etsy.com/listing/1753983331/dragon-book-comfort-colors-shirt?ref=shop_review,7.0,2025-08-26
GONdesignJEWELRY,1813741701,"Detroit Football Fan Comfort Colors Shirt, Detroit Game Day Shirts, Lions TShirt, Detroit T-Shirt, Funny Game Day Tee",,https://i.etsystatic.com/6369274788/r/il/a3a260/6369274788/il_340x270.6369274788_bay0.jpg,https://www.etsy.com/listing/1813741701/detroit-football-fan-comfort-colors?ref=shop_review,7.0,2025-08-26
GONdesignJEWELRY,4346153737,"Team Conrad Cousins Beach Shirt Comfort Colors, Trendy Cousins Beach Tee, Summer I Turned Pretty Inspired T-Shirt, Team Jeremiah Shirt",,https://i.etsystatic.com/7079165630/r/il/c7b4ad/7079165630/il_340x270.7079165630_qr7y.jpg,https://www.etsy.com/listing/4346153737/team-conrad-cousins-beach-shirt-comfort?ref=shop_review,1.0,2025-08-26
GONdesignJEWELRY,1833612946,"The Shire LOTR Comfort Colors Shirt For Fans, Fantasy Book Lover T Shirt, Funny Second Breakfast Tee, Gift For Book Lover",,https://i.etsystatic.com/6569082793/r/il/7667c1/6569082793/il_340x270.6569082793_6jq3.jpg,https://www.etsy.com/listing/1833612946/the-shire-lotr-comfort-colors-shirt-for?ref=shop_review,21.0,2025-08-26
GONdesignJEWELRY,1873365924,"Chestnut Springs Series Comfort Colors Shirt For Fan, Cowboy Romance Reader Club T Shirt, Bookish Gift for Country Girl, Wishing Well Ranch",,https://i.etsystatic.com/6712156156/r/il/fa0082/6712156156/il_340x270.6712156156_iwl5.jpg,https://www.etsy.com/listing/1873365924/chestnut-springs-series-comfort-colors?ref=shop_review,5.0,2025-08-26
GONdesignJEWELRY,1887331632,"Salty Moms Beach Club Comfort Colors Shirt, The Beach Club Shirt, Aesthetic Beach Shirt, Mother’s Day Shirt Gift, Summer Vibes Tee",,https://i.etsystatic.com/6831665069/r/il/b8b09d/6831665069/il_340x270.6831665069_dsub.jpg,https://www.etsy.com/listing/1887331632/salty-moms-beach-club-comfort-colors?ref=shop_review,15.0,2025-08-26
GONdesignJEWELRY,4343131745,"Spooky Island Comfort Colors Shirt, Halloween Disco Skull Tee, 90s Nostalgia Summer Spooky Gift, Trendy Halloween Apparel",,https://i.etsystatic.com/7062214106/r/il/f3121a/7062214106/il_340x270.7062214106_dzh8.jpg,https://www.etsy.com/listing/4343131745/spooky-island-comfort-colors-shirt?ref=shop_review,2.0,2025-08-25
GONdesignJEWELRY,4301408799,"Sunshine Daisies Butter Mellow Comfort Colors Shirt, Magic Candy Bean T Shirt, Funny Wizard Tee, Gift For HP Love",,https://i.etsystatic.com/6890036777/r/il/062e11/6890036777/il_340x270.6890036777_1ys2.jpg,https://www.etsy.com/listing/4301408799/sunshine-daisies-butter-mellow-comfort?ref=shop_review,5.0,2025-08-25
GONdesignJEWELRY,4332038646,"We All Swim Together Comfort Colors Shirt, Teacher Back to School Tee, Ocean Animal Classroom Shirt, Underwater Turtle Outfit",,https://i.etsystatic.com/7003017082/r/il/78dfae/7003017082/il_340x270.7003017082_mzuw.jpg,https://www.etsy.com/listing/4332038646/we-all-swim-together-comfort-colors?ref=shop_review,3.0,2025-08-24
GONdesignJEWELRY,1869970326,"Xaden Riorson Quote Comfort Colors Shirt, Fourth Wing Book Quotes, Xaddy Shirt, I Love You In Book Quotes, Romantasy Book Merch",,https://i.etsystatic.com/6742952725/r/il/de8bd6/6742952725/il_340x270.6742952725_89sp.jpg,https://www.etsy.com/listing/1869970326/xaden-riorson-quote-comfort-colors-shirt?ref=shop_review,11.0,2025-08-23
GONdesignJEWELRY,1744959908,"SJM Tour Comfort Colors Shirt, The Mass Tour Shirt, Acotar Shirt, Crescent City Merch, Throne Of Glass Shirt Merch, SJM Merch",,https://i.etsystatic.com/6161126109/r/il/0169bd/6161126109/il_340x270.6161126109_fxc1.jpg,https://www.etsy.com/listing/1744959908/sjm-tour-comfort-colors-shirt-the-mass?ref=shop_review,3.0,2025-08-23
GONdesignJEWELRY,1743087718,"The Thirteen Throne Of Glass Comfort Colors Shirt, Sjm Merch, From Now Until The Darkness Claims Us Shirt, We Are The Thirteen, Bookish Gift",,https://i.etsystatic.com/6152739971/r/il/c64079/6152739971/il_340x270.6152739971_dcut.jpg,https://www.etsy.com/listing/1743087718/the-thirteen-throne-of-glass-comfort?ref=shop_review,8.0,2025-08-23
GONdesignJEWELRY,1863063802,"Plated Prisoner Comfort Colors Shirt For Fan, Auren Goldfinch T Shirt, Gold Cage Tee, Gift For Book Lover",,https://i.etsystatic.com/6659771658/r/il/2f47a7/6659771658/il_340x270.6659771658_3vcj.jpg,https://www.etsy.com/listing/1863063802/plated-prisoner-comfort-colors-shirt-for?ref=shop_review,3.0,2025-08-23
GONdesignJEWELRY,1834163623,"Funny Astarion Game Fan Comfort Colors Shirt, You’re Not Alone T Shirt, Astarion BG3 Shirts, High Elf Gaming Apparel, Dark Humor Tee",,https://i.etsystatic.com/6516465751/r/il/b055ab/6516465751/il_340x270.6516465751_q26b.jpg,https://www.etsy.com/listing/1834163623/funny-astarion-game-fan-comfort-colors?ref=shop_review,6.0,2025-08-22
GONdesignJEWELRY,4319880515,"Lilo And Stitch Pudge Controls The Weather Shirt Comfort Colors, Pudge Fish T-Shirt, Family Matching Shirt, Magic Kingdom Trip Tee",,https://i.etsystatic.com/6984584463/r/il/f0ef2c/6984584463/il_340x270.6984584463_9v9h.jpg,https://www.etsy.com/listing/4319880515/lilo-and-stitch-pudge-controls-the?ref=shop_review,2.0,2025-08-22
GONdesignJEWELRY,1808232499,"Acotar All Booked for Christmas Comfort Colors Shirt, SJM Book Lover Shirt,Throne of Glass, Bookish Xmas Gift, Christmas Book Lover TShirt",,https://i.etsystatic.com/6340709218/r/il/7d092e/6340709218/il_340x270.6340709218_2tzo.jpg,https://www.etsy.com/listing/1808232499/acotar-all-booked-for-christmas-comfort?ref=shop_review,1.0,2025-08-21
GONdesignJEWELRY,4295845473,"Leather and Lark Dark Romance Comfort Colors Shirt, Multiple Deleters Club T Shirt, Brynne Inspired Book Shirt, Gift For Book Lover",,https://i.etsystatic.com/6861870259/r/il/440c08/6861870259/il_340x270.6861870259_s7m0.jpg,https://www.etsy.com/listing/4295845473/leather-and-lark-dark-romance-comfort?ref=shop_review,6.0,2025-08-21
GONdesignJEWELRY,1872822500,"Xaden Riorson House Comfort Colors Shirt, Xaddy Shirt, Dragon Rider 2-Sided Shirt, Fourth Wing Fan Merch, Onyx Storm,Romantasy Bookish Gifts",,https://i.etsystatic.com/6709352192/r/il/55d7d9/6709352192/il_340x270.6709352192_k9be.jpg,https://www.etsy.com/listing/1872822500/xaden-riorson-house-comfort-colors-shirt?ref=shop_review,1.0,2025-08-21
GONdesignJEWELRY,4343710881,"It’s All In The Hip Comfort Colors Shirt, Funny Happy Golf Movie Inspired T Shirt, 90s Golf Movie Tee, Just Tap It In",,https://i.etsystatic.com/7065440812/r/il/05a746/7065440812/il_340x270.7065440812_j9nc.jpg,https://www.etsy.com/listing/4343710881/its-all-in-the-hip-comfort-colors-shirt?ref=shop_review,1.0,2025-08-21
GONdesignJEWELRY,1838116926,"Manon The Kin Slayer Comfort Colors Shirt, The Thirteen Two Sided TShirt For Fan, TOG From Now Until The Darkness, Gift For Book Lover",,https://i.etsystatic.com/6538112078/r/il/586449/6538112078/il_340x270.6538112078_5qrp.jpg,https://www.etsy.com/listing/1838116926/manon-the-kin-slayer-comfort-colors?ref=shop_review,1.0,2025-08-20
GONdesignJEWELRY,1781190023,"Acotar Ghost Reading Book Comfort Colors Shirt, SJM Book Shirt, Bookish Ghost Tee, Throne of Glass, SJM Book Reader, Halloween Book Lover",,https://i.etsystatic.com/6257887963/r/il/af4fc6/6257887963/il_340x270.6257887963_dw0z.jpg,https://www.etsy.com/listing/1781190023/acotar-ghost-reading-book-comfort-colors?ref=shop_review,2.0,2025-08-20
GONdesignJEWELRY,1803645934,"Kelce Football Comfort Colors Shirt, Miss Americana Football T Shirt, Karma Is The Guy On The Chiefs, Kelce’s Tight End ,Game Day Football",,https://i.etsystatic.com/6389626874/r/il/0bce55/6389626874/il_340x270.6389626874_v6bc.jpg,https://www.etsy.com/listing/1803645934/kelce-football-comfort-colors-shirt-miss?ref=shop_review,3.0,2025-08-19
GONdesignJEWELRY,4347279519,"Boys Of Tommen Books Stamp Comfort Colors Shirt, Tommen College Shirt, Kavanagh 13 Tshirt, Trendy College Shirt, Bookish Merch",,https://i.etsystatic.com/7085020848/r/il/5ab314/7085020848/il_340x270.7085020848_531s.jpg,https://www.etsy.com/listing/4347279519/boys-of-tommen-books-stamp-comfort?ref=shop_review,1.0,2025-08-19
GONdesignJEWELRY,1775195040,"Foxfire Academy Comfort Colors Shirt, Keeper Of The Lost Cities Symbols Shirt, KOTLC TShirt, Bookish Gifts, Foxfire Academy Merch",,https://i.etsystatic.com/6297903671/r/il/5c0d6a/6297903671/il_340x270.6297903671_il6s.jpg,https://www.etsy.com/listing/1775195040/foxfire-academy-comfort-colors-shirt?ref=shop_review,6.0,2025-08-18
GONdesignJEWELRY,4300885698,"Multiple Deleters Club Comfort Colors Shirt, Feckin Catastrophe T Shirt, Leather and Lark Dark Romance Tee, Brynne Inspire, Bookish Gift",,https://i.etsystatic.com/6887399571/r/il/45f1ef/6887399571/il_340x270.6887399571_tje8.jpg,https://www.etsy.com/listing/4300885698/multiple-deleters-club-comfort-colors?ref=shop_review,1.0,2025-08-18
GONdesignJEWELRY,1889438405,"Baseball Mom Take Me Out To The Ballgame Comfort Colors Shirt, Funny Baseball Mom Shirt, Baseball Season Tee, Game Day Apparel, Sport Mom",,https://i.etsystatic.com/6770103767/r/il/53d844/6770103767/il_340x270.6770103767_otu0.jpg,https://www.etsy.com/listing/1889438405/baseball-mom-take-me-out-to-the-ballgame?ref=shop_review,1.0,2025-08-17
GONdesignJEWELRY,1879169364,"Scythe & Sparrow Silveria Circus Comfort Colors Shirt, Butcher And Blackbird Inspired Tshirt, Dark Romance Book Merch,Brynne Weaver Apparel",,https://i.etsystatic.com/6742562806/r/il/29c5e6/6742562806/il_340x270.6742562806_moyo.jpg,https://www.etsy.com/listing/1879169364/scythe-sparrow-silveria-circus-comfort?ref=shop_review,2.0,2025-08-17
GONdesignJEWELRY,1782823527,"Enemies To Lovers Comfort Colors Shirt, Romantasy T Shirt, Dark Romance Reader, Book Club Shirt, Gift For Book Lover",,https://i.etsystatic.com/6265636431/r/il/534cd5/6265636431/il_340x270.6265636431_r8nq.jpg,https://www.etsy.com/listing/1782823527/enemies-to-lovers-comfort-colors-shirt?ref=shop_review,3.0,2025-08-15
GONdesignJEWELRY,1819970866,"Society Of Obstinate Headstrong Girls Comfort Colors Shirt, Strong Girl Shirt, Feminist Shirt, Women’s Rights TShirt",,https://i.etsystatic.com/6468384610/r/il/8e168c/6468384610/il_340x270.6468384610_m436.jpg,https://www.etsy.com/listing/1819970866/society-of-obstinate-headstrong-girls?ref=shop_review,1.0,2025-08-15
