shop_name,listing_id,title,tags,image_1,etsy_url,review_count,last_review_date
GONdesignJEWELRY,1863284009,"I Love My Cougar Girlfriend Comfort Colors Shirt, Two Sided Shirt For Boyfriend, Funny Cougar Girlfriend Tee, Gift For Him",,https://i.etsystatic.com/6638484511/r/il/41de36/6638484511/il_340x270.6638484511_4xzf.jpg,https://www.etsy.com/listing/1863284009/i-love-my-cougar-girlfriend-comfort?ref=shop_review,5.0,2025-10-08
GONdesignJEWELRY,4347273296,"Stars Hollow Luke's Diner Comfort Colors Shirt, Luke’s Coffee Mug Tee, Stars Hollow Connecticut Long Sleeve, Autumn Festival Gift",,https://i.etsystatic.com/7085016294/r/il/71051e/7085016294/il_340x270.7085016294_bnv2.jpg,https://www.etsy.com/listing/4347273296/stars-hollow-lukes-diner-comfort-colors?ref=shop_review,1.0,2025-10-06
GONdesignJEWELRY,1858558633,"Villain Assistant Comfort Colors Shirt For Fan, Greeting From Rennedawn T Shirt, Villain Lover Tee, Funny Gift For Romantasy Book Lover",,https://i.etsystatic.com/6567404770/r/il/5b3179/6567404770/il_340x270.6567404770_atc1.jpg,https://www.etsy.com/listing/1858558633/villain-assistant-comfort-colors-shirt?ref=shop_review,8.0,2025-10-03
GONdesignJEWELRY,4328546006,"Fourth Wing Books Stamp Shirt Comfort Colors, Fourth Wing Inspired Shirt, Dragon Rider Shirt, Romantasy Fan Shirt, Book Lovers Tee",,https://i.etsystatic.com/7030864639/r/il/4069d7/7030864639/il_340x270.7030864639_8fvq.jpg,https://www.etsy.com/listing/4328546006/fourth-wing-books-stamp-shirt-comfort?ref=shop_review,1.0,2025-10-02
GONdesignJEWELRY,1882605049,"Beware Of A Vampire Comfort Colors Shirt, Funny Astarion Game Fan T Shirt, Astarion Dark Humor BG3 Apparel, High Elf Game",,https://i.etsystatic.com/6687113578/r/il/9ad386/6687113578/il_340x270.6687113578_joro.jpg,https://www.etsy.com/listing/1882605049/beware-of-a-vampire-comfort-colors-shirt?ref=shop_review,1.0,2025-09-30
GONdesignJEWELRY,4333147924,"Retro Spooky Island Shirt Comfort Colors,  Disco Skull Cartoon Halloween Movie T Shirt, The 90s SDWAY Tee, Halloween Skeleton Gift",,https://i.etsystatic.com/7056537381/r/il/284e9c/7056537381/il_340x270.7056537381_8sr9.jpg,https://www.etsy.com/listing/4333147924/retro-spooky-island-shirt-comfort-colors?ref=shop_review,2.0,2025-09-28
GONdesignJEWELRY,1796473638,"Stars Hollow Where You Lead I Will Follow Comfort Colors Shirt, Lukes Diner Shirt, 2 Sided Stars Hollow, Retro Gilmore Girls Tee",,https://i.etsystatic.com/6402185285/r/il/d9f1b8/6402185285/il_340x270.6402185285_mz4o.jpg,https://www.etsy.com/listing/1796473638/stars-hollow-where-you-lead-i-will?ref=shop_review,16.0,2025-09-27
GONdesignJEWELRY,1861983874,"Run Little Mouse Comfort Colors Shirt, Rose Skeleton Shirt, Haunting Adeline Tshirt, Dark Romance Merch, Smut Reader, Book Lover Gifts",,https://i.etsystatic.com/6654307922/r/il/50b192/6654307922/il_340x270.6654307922_skzi.jpg,https://www.etsy.com/listing/1861983874/run-little-mouse-comfort-colors-shirt?ref=shop_review,9.0,2025-09-25
GONdesignJEWELRY,1873237315,"Ridoc Quest Squad Comfort Colors Shirt, I Kept The Inside Thoughts Inside Tee, Onyx Storm Fourth Wing Shirt For Fans, Bookish Gift",,https://i.etsystatic.com/6641562060/r/il/6cb091/6641562060/il_340x270.6641562060_ih0l.jpg,https://www.etsy.com/listing/1873237315/ridoc-quest-squad-comfort-colors-shirt-i?ref=shop_review,20.0,2025-09-25
GONdesignJEWELRY,1842339560,"Jasmine Dragon Tea Shop Comfort Colors Shirt, Uncle Iroh Shirt Gift, Anime Lover's Gift, Uncle Iroh Tea Shop Inspired, Avatar TShirt",,https://i.etsystatic.com/6557721462/r/il/128753/6557721462/il_340x270.6557721462_a4nm.jpg,https://www.etsy.com/listing/1842339560/jasmine-dragon-tea-shop-comfort-colors?ref=shop_review,40.0,2025-09-24
GONdesignJEWELRY,4329603866,"TOG Book Stamps Comfort Colors Shirt, Terrasen The Thirteen T Shirt, Aelin Fireheart Tee, TOG Series Gift For Book Lover",,https://i.etsystatic.com/7036747971/r/il/4eb391/7036747971/il_340x270.7036747971_p053.jpg,https://www.etsy.com/listing/4329603866/tog-book-stamps-comfort-colors-shirt?ref=shop_review,1.0,2025-09-23
GONdesignJEWELRY,4329098307,"The Parent Trap Camp Walden Comfort Colors Shirt, 90s Nostalgia TShirt, Hallie Annie Parker Birthday Gift, Camp Walden Vacation Shirt",,https://i.etsystatic.com/7033861137/r/il/22bf99/7033861137/il_340x270.7033861137_qpff.jpg,https://www.etsy.com/listing/4329098307/the-parent-trap-camp-walden-comfort?ref=shop_review,2.0,2025-09-23
GONdesignJEWELRY,1738772906,"Shadowsinger Night Court Comfort Color Shirts, Azriel SJM Book Merch Inspired, The Bat Boys Velraris Tee",,https://i.etsystatic.com/6087147986/r/il/f15451/6087147986/il_340x270.6087147986_odir.jpg,https://www.etsy.com/listing/1738772906/shadowsinger-night-court-comfort-color?ref=shop_review,15.0,2025-09-23
GONdesignJEWELRY,1803076530,"Throne Of Glass Fan Comfort Colors Shirt, Aelin Galathynius Fireheart Aelin T Shirt, Kingsflame The Thirteen",,https://i.etsystatic.com/6386807788/r/il/9f96f6/6386807788/il_340x270.6386807788_o382.jpg,https://www.etsy.com/listing/1803076530/throne-of-glass-fan-comfort-colors-shirt?ref=shop_review,3.0,2025-09-23
GONdesignJEWELRY,1883106261,"Fireheart TOG Fan Merch Comfort Colors Shirt, Aelin Galathynius Fireheart T Shirt, To Whatever End Tee, Bookish Gift, Fantasy Apparel",,https://i.etsystatic.com/6689656254/r/il/1e0b90/6689656254/il_340x270.6689656254_ga2j.jpg,https://www.etsy.com/listing/1883106261/fireheart-tog-fan-merch-comfort-colors?ref=shop_review,17.0,2025-09-23
GONdesignJEWELRY,1774617902,"Green Bay Football Comfort Colors Shirt, Sunday Football Shirts, Green Bay Fan Tee, Sunday Funday Game Day TShirt",,https://i.etsystatic.com/6295155771/r/il/b0498f/6295155771/il_340x270.6295155771_6nj1.jpg,https://www.etsy.com/listing/1774617902/green-bay-football-comfort-colors-shirt?ref=shop_review,14.0,2025-09-23
GONdesignJEWELRY,4321251586,"Retro No Kings Since 1776 Shirt Comfort Colors, Rejecting Kings Shirt, No Kings In America 86/47, 4th Of July America Tee",,https://i.etsystatic.com/6944028536/r/il/34a7c7/6944028536/il_340x270.6944028536_d1il.jpg,https://www.etsy.com/listing/4321251586/retro-no-kings-since-1776-shirt-comfort?ref=shop_review,29.0,2025-09-22
GONdesignJEWELRY,1861685575,"Little Osha Butterfly Comfort Colors Shirt, Quicksilver Callie Hart Shirt, Saeris Fane Kingfisher Inspired Tee, Quicksilver Fan Tshirt",,https://i.etsystatic.com/6630489915/r/il/bcee2e/6630489915/il_340x270.6630489915_p9fz.jpg,https://www.etsy.com/listing/1861685575/little-osha-butterfly-comfort-colors?ref=shop_review,45.0,2025-09-21
GONdesignJEWELRY,1817839499,"Crescent City Fans Comfort Colors Shirt, Lunathion Light It Up Shirts, SJM Inspired T Shirt, Gift For Book Lover",,https://i.etsystatic.com/6437698277/r/il/87f413/6437698277/il_340x270.6437698277_pfxi.jpg,https://www.etsy.com/listing/1817839499/crescent-city-fans-comfort-colors-shirt?ref=shop_review,1.0,2025-09-20
GONdesignJEWELRY,1875249568,"Excellent Boiled Potatoes Comfort Colors Shirt, Pride and Prejudice Fan T Shirt, Funny Jane Austen Tee, Gift For Book Lovers",,https://i.etsystatic.com/6778448958/r/il/918a85/6778448958/il_340x270.6778448958_onfx.jpg,https://www.etsy.com/listing/1875249568/excellent-boiled-potatoes-comfort-colors?ref=shop_review,7.0,2025-09-20
GONdesignJEWELRY,1742663608,"Jelly Jubilee Crescent City Comfort Colors Shirt, Bryce Quinlan Merch, Crescent City SJM Shirt, Jelly Jubilee Fan Club, 2 Sided Shirt",,https://i.etsystatic.com/6150645837/r/il/70f998/6150645837/il_340x270.6150645837_byus.jpg,https://www.etsy.com/listing/1742663608/jelly-jubilee-crescent-city-comfort?ref=shop_review,18.0,2025-09-20
GONdesignJEWELRY,4321846549,"Princess Donut & Mongo Shirt Comfort Colors, New Achievement Shirt, Dungeon Crawler Carl T Shirt, Bookish Apparel for Book Lovers",,https://i.etsystatic.com/6995158969/r/il/3fe9a2/6995158969/il_340x270.6995158969_czpt.jpg,https://www.etsy.com/listing/4321846549/princess-donut-mongo-shirt-comfort?ref=shop_review,1.0,2025-09-20
GONdesignJEWELRY,4311241305,"Cat Biscuit Maker Shirt Comfort Colors, Retro Kitty Kneading T-Shirt, Cat Lover Gift, Baking Cat Shirt, Kitty Biscuits Bakery Tee",,https://i.etsystatic.com/6939844863/r/il/4310dd/6939844863/il_340x270.6939844863_h924.jpg,https://www.etsy.com/listing/4311241305/cat-biscuit-maker-shirt-comfort-colors?ref=shop_review,1.0,2025-09-19
GONdesignJEWELRY,4305201691,"I Still Read Fairy Tales Shirt Comfort Colors, Spicy Bookish Tee, Fantasy Dark Romance Smut Shirt, Book Lover Gift For Her, Bookworm Gift",,https://i.etsystatic.com/6908845923/r/il/b663a2/6908845923/il_340x270.6908845923_gt2q.jpg,https://www.etsy.com/listing/4305201691/i-still-read-fairy-tales-shirt-comfort?ref=shop_review,2.0,2025-09-19
GONdesignJEWELRY,4309512488,"The Thirteen Throne Of Glass Comfort Colors Shirt, Abraxos Dragon TShirt, Fantasy Floral Dragon T-Shirt, SJM Fan Gift, Bookish Merch",,https://i.etsystatic.com/6930759387/r/il/24f45a/6930759387/il_340x270.6930759387_qg8o.jpg,https://www.etsy.com/listing/4309512488/the-thirteen-throne-of-glass-comfort?ref=shop_review,2.0,2025-09-18
GONdesignJEWELRY,4298157013,"Shadow Daddy Romantasy Comfort Colors Shirt, Shadow Daddy Book Club T shirt, Dark Romance Tee, Gift For Book Lover",,https://i.etsystatic.com/6825699176/r/il/0c77a7/6825699176/il_340x270.6825699176_bbel.jpg,https://www.etsy.com/listing/4298157013/shadow-daddy-romantasy-comfort-colors?ref=shop_review,1.0,2025-09-17
GONdesignJEWELRY,4315987438,"It’s A Good Day To Read Shirt Comfort Colors, Cute Book Lover T-Shirt, Aesthetic Reading Tee, Bookish Gift For Readers, Teacher Shirt",,https://i.etsystatic.com/6964632851/r/il/5dd1ed/6964632851/il_340x270.6964632851_ocq8.jpg,https://www.etsy.com/listing/4315987438/its-a-good-day-to-read-shirt-comfort?ref=shop_review,1.0,2025-09-17
GONdesignJEWELRY,1761365400,"Ruhn Danaan Knew Three Things Crescent City Comfort Colors Shirt, Ruhn Danaan Shirt, Crescent City Sjm Merch,  Valbaran Fae Crown Prince",,https://i.etsystatic.com/6184534568/r/il/be468f/6184534568/il_340x270.6184534568_h95g.jpg,https://www.etsy.com/listing/1761365400/ruhn-danaan-knew-three-things-crescent?ref=shop_review,2.0,2025-09-17
GONdesignJEWELRY,1906065927,"Xaden Riorson Comfort Colors Shirt, Funny Fourth Wing Dragon Rider Quote T Shirt, Well The Aware Tee, Gift For Book Lover",,https://i.etsystatic.com/6806451734/r/il/9a903a/6806451734/il_340x270.6806451734_7kf5.jpg,https://www.etsy.com/listing/1906065927/xaden-riorson-comfort-colors-shirt-funny?ref=shop_review,4.0,2025-09-15
GONdesignJEWELRY,4342569946,"TSITP Cousins Beach Shirt Comfort Colors, Cousins Beach Tee, Summer I Turned Pretty Inspired Shirt, TSITP Quotes, Team Conrad Team Jeramiah",,https://i.etsystatic.com/7059078058/r/il/75ca94/7059078058/il_340x270.7059078058_no26.jpg,https://www.etsy.com/listing/4342569946/tsitp-cousins-beach-shirt-comfort-colors?ref=shop_review,2.0,2025-09-14
GONdesignJEWELRY,4348446438,"Fruit of the Spirit Shirt Comfort Colors, Christian Bible Verse Fruit T Shirt, Vintage Faith Tee, Galatians Religious Faith Apparel",,https://i.etsystatic.com/7091212364/r/il/494606/7091212364/il_340x270.7091212364_sffp.jpg,https://www.etsy.com/listing/4348446438/fruit-of-the-spirit-shirt-comfort-colors?ref=shop_review,1.0,2025-09-14
GONdesignJEWELRY,1873254505,"Onyx Storm Quest Squad Broccoli Comfort Colors Shirt, Fourth Wing Shirt, Broccoli Cat TShirt, Ridoc Romantasy Fan Shirt, Dragon Rider Tee",,https://i.etsystatic.com/6639380422/r/il/a404db/6639380422/il_340x270.6639380422_5ak9.jpg,https://www.etsy.com/listing/1873254505/onyx-storm-quest-squad-broccoli-comfort?ref=shop_review,49.0,2025-09-14
GONdesignJEWELRY,1834454236,"Basgiath War College 2 Sided Comfort Colors Shirt, Vintage Dragon Rider TShirt,  Fourth Wing Riders Quadrant,Trendy Book Merch,Bookish Gifts",,https://i.etsystatic.com/6572047861/r/il/c15703/6572047861/il_340x270.6572047861_4vw6.jpg,https://www.etsy.com/listing/1834454236/basgiath-war-college-2-sided-comfort?ref=shop_review,27.0,2025-09-13
GONdesignJEWELRY,1761371890,"Aelin Galathynius Fireheart Comfort Colors Shirt, Terrasen TOG TShirt, SJM Inspire Two Sides, Kingsflame The Thirteen, Book Merch",,https://i.etsystatic.com/6232606867/r/il/309059/6232606867/il_340x270.6232606867_nf3a.jpg,https://www.etsy.com/listing/1761371890/aelin-galathynius-fireheart-comfort?ref=shop_review,5.0,2025-09-13
GONdesignJEWELRY,1899972965,"Mr Darcy Pride and Prejudice Comfort Colors Shirt, You Have Bewitched Me T Shirt, Pemberley Jane Austen Merch, Fitzwilliam Darcy Tee Gift",,https://i.etsystatic.com/6781110960/r/il/6e0543/6781110960/il_340x270.6781110960_g7lr.jpg,https://www.etsy.com/listing/1899972965/mr-darcy-pride-and-prejudice-comfort?ref=shop_review,6.0,2025-09-13
GONdesignJEWELRY,1901515435,"Montague Muffins Leather And Lark Comfort Colors Shirt, Butcher And Blackbird Book Series TShirt For Fan, Gift For Book Lover",,https://i.etsystatic.com/6831672719/r/il/9ca773/6831672719/il_340x270.6831672719_qnjg.jpg,https://www.etsy.com/listing/1901515435/montague-muffins-leather-and-lark?ref=shop_review,1.0,2025-09-12
GONdesignJEWELRY,1785333617,"Banned Books Club Comfort Colors Shirt, I'm With The Banned T Shirt, Dark Academia Librarian Tee, Gift For Book Lover, Bookish Shirt",,https://i.etsystatic.com/6277501505/r/il/4210c6/6277501505/il_340x270.6277501505_qps0.jpg,https://www.etsy.com/listing/1785333617/banned-books-club-comfort-colors-shirt?ref=shop_review,3.0,2025-09-10
GONdesignJEWELRY,1757274509,"Violet Apothecary Comfort Colors Shirt, Basgiath War College Merch, Fourth Wing Shirts, Riders Quadrant, Bookish Tee, Gift For Book Lover",,https://i.etsystatic.com/6104605440/r/il/093db7/6104605440/il_340x270.6104605440_93cg.jpg,https://www.etsy.com/listing/1757274509/violet-apothecary-comfort-colors-shirt?ref=shop_review,13.0,2025-09-09
GONdesignJEWELRY,4335124845,"Stars Hollows Connecticut Stamps Shirt Comfort Colors, Luke's Coffee T Shirt, No Cell Phone Dragonfly Inn, TV Show Fans Gift",,https://i.etsystatic.com/7066249029/r/il/908aea/7066249029/il_340x270.7066249029_qet4.jpg,https://www.etsy.com/listing/4335124845/stars-hollows-connecticut-stamps-shirt?ref=shop_review,2.0,2025-09-08
GONdesignJEWELRY,1796480438,"Funny Fans Comfort Colors Shirt, Only Fans Inspired Meme T Shirt, Fan Of Fans, Funny Gift For Friends, Trendy Shirt",,https://i.etsystatic.com/6354137316/r/il/db5574/6354137316/il_340x270.6354137316_9bib.jpg,https://www.etsy.com/listing/1796480438/funny-fans-comfort-colors-shirt-only?ref=shop_review,4.0,2025-09-07
GONdesignJEWELRY,4307978357,"Night Owl Reader Shirt Comfort Colors, Late Night Reading Book Club Shirt, Trendy Book Shirt, Book Lover Gift, Cute Bookworm Tee",,https://i.etsystatic.com/6874975428/r/il/6a2a38/6874975428/il_340x270.6874975428_1ytr.jpg,https://www.etsy.com/listing/4307978357/night-owl-reader-shirt-comfort-colors?ref=shop_review,5.0,2025-09-07
GONdesignJEWELRY,4328067058,"Progress Is Not Linear Teacher Comfort Colors Shirt, SPED Teacher Gift, Mental Health Awareness TShirt, Special Education Teacher Shirts",,https://i.etsystatic.com/6980357924/r/il/ad133d/6980357924/il_340x270.6980357924_ph7k.jpg,https://www.etsy.com/listing/4328067058/progress-is-not-linear-teacher-comfort?ref=shop_review,1.0,2025-09-07
GONdesignJEWELRY,4297649211,"Acotar The Night Court Comfort Colors Shirt, Acotar Velaris Night Court Shirt, City Of Starlight Court Of Dreams, Inner Circle Acotar Tee",,https://i.etsystatic.com/6871158809/r/il/af7882/6871158809/il_340x270.6871158809_1k11.jpg,https://www.etsy.com/listing/4297649211/acotar-the-night-court-comfort-colors?ref=shop_review,2.0,2025-09-06
GONdesignJEWELRY,1855552592,"Fourth Wing Quest Squad Comfort Colors Shirt, Ridoc Dragon Rider T Shirt, Onyx Storm Riorson House Tee, Gift For Book Lover",,https://i.etsystatic.com/6621971434/r/il/263a11/6621971434/il_340x270.6621971434_s4c6.jpg,https://www.etsy.com/listing/1855552592/fourth-wing-quest-squad-comfort-colors?ref=shop_review,6.0,2025-03-20
GONdesignJEWELRY,1800623419,"Trendy Hoa Hoa Hoa Season Comfort Colors Shirt, Forks Washington Shirt, Movie Inspired Tshirt, Hoa Hoa Hoa Hoa Cozy Season",,https://i.etsystatic.com/6350589455/r/il/650eed/6350589455/il_340x270.6350589455_a8vp.jpg,https://www.etsy.com/listing/1800623419/trendy-hoa-hoa-hoa-season-comfort-colors?ref=shop_review,4.0,2025-03-19
GONdesignJEWELRY,1810955810,"Wicked Musical Comfort Colors Shirt, Wicked Defy Gravity Changed For Good Shirt, Wizard Movie Fan Tee, Pink Green Together We’re Unlimited",,https://i.etsystatic.com/6426005546/r/il/c61eb7/6426005546/il_340x270.6426005546_n1w4.jpg,https://www.etsy.com/listing/1810955810/wicked-musical-comfort-colors-shirt?ref=shop_review,8.0,2025-03-19
GONdesignJEWELRY,1858034955,"Morally Grey Fan Comfort Colors Shirt, Dark Romance Book Club T Shirt, Tee For Spicy Book Lovers, Run Little Mouse, Bookish Gift",,https://i.etsystatic.com/6564950358/r/il/853067/6564950358/il_340x270.6564950358_1h2u.jpg,https://www.etsy.com/listing/1858034955/morally-grey-fan-comfort-colors-shirt?ref=shop_review,1.0,2025-03-18
GONdesignJEWELRY,1829127971,"Custom Birthday Shirt for Wizard Fans, Happee Birthdae Sweatshirt, Magical Cake Hoodie, Gift For Book Lover",,https://i.etsystatic.com/6492910159/r/il/11dea4/6492910159/il_340x270.6492910159_1tzk.jpg,https://www.etsy.com/listing/1829127971/custom-birthday-shirt-for-wizard-fans?ref=shop_review,1.0,2025-03-18
GONdesignJEWELRY,1849578554,"The Shire LOTR Tote Bag For Fans, Fantasy Book Lover Canvas Bag, Funny Second Breakfast Tote, Gift For Book Enthusiast",,https://i.etsystatic.com/6640936015/r/il/7cb940/6640936015/il_340x270.6640936015_frlq.jpg,https://www.etsy.com/listing/1849578554/the-shire-lotr-tote-bag-for-fans-fantasy?ref=shop_review,1.0,2025-03-17
GONdesignJEWELRY,1795421570,"Funny Astarion Game Fan Tote Bag, Astarion BG3 Tote Gift, Astarion’s Juice Box BG3 Canvas Bag, High Elf Gaming Apparel",,https://i.etsystatic.com/6347598136/r/il/473636/6347598136/il_340x270.6347598136_sz7g.jpg,https://www.etsy.com/listing/1795421570/funny-astarion-game-fan-tote-bag?ref=shop_review,4.0,2025-03-16
GONdesignJEWELRY,1795425702,"Acotar Velaris Coffee Mug, Acotar The Night Court 11oz 15oz Ceramic Mug, SJM Mug Merch, Gift For Book Lover",,https://i.etsystatic.com/6347621800/r/il/444a76/6347621800/il_340x270.6347621800_dhu0.jpg,https://www.etsy.com/listing/1795425702/acotar-velaris-coffee-mug-acotar-the?ref=shop_review,2.0,2025-03-14
GONdesignJEWELRY,1855484525,"Xaden Riorson Comfort Colors Shirt, Trendy Xaddy Shirt, Xaden Fourth Wing Fan Shirt, Onyx Storm Merch, Dragon Rider 2 Sided TShirt",,https://i.etsystatic.com/6552523846/r/il/38486f/6552523846/il_340x270.6552523846_qmy3.jpg,https://www.etsy.com/listing/1855484525/xaden-riorson-comfort-colors-shirt?ref=shop_review,4.0,2025-03-12
GONdesignJEWELRY,1869207353,"Amortentia Love Potion Comfort Colors Shirt, Bookish Gift For Fan, Wizard Shirt, Bookish Valentine Shirt, Potions Classroom",,https://i.etsystatic.com/6667494241/r/il/a1b20b/6667494241/il_340x270.6667494241_4clt.jpg,https://www.etsy.com/listing/1869207353/amortentia-love-potion-comfort-colors?ref=shop_review,1.0,2025-03-12
GONdesignJEWELRY,1756854897,"Lady Whistledown Comfort Colors Shirt, Spill The Tea Royal T Shirt, Bridgerton Series Inspired, Movie Fan Shirt",,https://i.etsystatic.com/6150635735/r/il/6387c7/6150635735/il_340x270.6150635735_r8w4.jpg,https://www.etsy.com/listing/1756854897/lady-whistledown-comfort-colors-shirt?ref=shop_review,1.0,2025-03-07
GONdesignJEWELRY,1810374310,"Eating Junk And Watching Rubbish Christmas Sweatshirt, Christmas Movie Quote Crewneck, Ugly Christmas Sweater, Unisex Xmas Holiday Hoodie",,https://i.etsystatic.com/6471306797/r/il/f69274/6471306797/il_340x270.6471306797_2z4s.jpg,https://www.etsy.com/listing/1810374310/eating-junk-and-watching-rubbish?ref=shop_review,2.0,2025-03-03
GONdesignJEWELRY,1819969190,"Hot Girls Read Book Sweatshirt, Born To Read Bookish Crewneck, Bookish Shirt For Her, Funny Reader Shirt, Gift For Book Lover",,https://i.etsystatic.com/6468375898/r/il/3181d7/6468375898/il_340x270.6468375898_366q.jpg,https://www.etsy.com/listing/1819969190/hot-girls-read-book-sweatshirt-born-to?ref=shop_review,2.0,2025-03-01
GONdesignJEWELRY,1799536807,"Stars Hollow Ceramic Mug, Stars Hollow 11oz 15oz Coffee Cups, Gilmore Girls Merch, Luke’s Diner Mug",,https://i.etsystatic.com/6297110346/r/il/28bccf/6297110346/il_340x270.6297110346_hfhf.jpg,https://www.etsy.com/listing/1799536807/stars-hollow-ceramic-mug-stars-hollow?ref=shop_review,1.0,2025-02-28
GONdesignJEWELRY,1855011656,"Run Little Mouse Comfort Colors Shirt, Haunting Adeline Shirt, Dark Romance Book Merch, Spicy Book Shirt, Smut Reader Gift, Cat and Mouse",,https://i.etsystatic.com/6619406596/r/il/f0f5b1/6619406596/il_340x270.6619406596_1xff.jpg,https://www.etsy.com/listing/1855011656/run-little-mouse-comfort-colors-shirt?ref=shop_review,1.0,2025-02-27
GONdesignJEWELRY,1837621935,"ACOTAR Is Self-Care Comfort Colors Shirt, SJM Tshirt For Fan, Bookish Mental Health Tee, Gift For Book Lover",,https://i.etsystatic.com/6482865858/r/il/49fc7a/6482865858/il_340x270.6482865858_ns36.jpg,https://www.etsy.com/listing/1837621935/acotar-is-self-care-comfort-colors-shirt?ref=shop_review,1.0,2025-02-25
GONdesignJEWELRY,1753425623,"The Maas Cat Comfort Colors Shirt, SJM Fan Gift, Acotar T Shirt, SJM Book Cats Tee, Cat Lover Gift, Funny SJM Book Tour",,https://i.etsystatic.com/6134813657/r/il/f407aa/6134813657/il_340x270.6134813657_ovpk.jpg,https://www.etsy.com/listing/1753425623/the-maas-cat-comfort-colors-shirt-sjm?ref=shop_review,3.0,2025-02-25
GONdesignJEWELRY,1831015014,"Onyx Storm Comfort Colors Shirt, Fourth Wing Merch, Basgiath War College TShirt, Dragon Lover Shirt, Fourth Wing Xaden Riorson Fan",,https://i.etsystatic.com/6511639588/r/il/b9df23/6511639588/il_340x270.6511639588_7wf7.jpg,https://www.etsy.com/listing/1831015014/onyx-storm-comfort-colors-shirt-fourth?ref=shop_review,1.0,2025-02-20
GONdesignJEWELRY,1829134995,"Christmas Cardiac Nurse Comfort Colors Shirt, Heart Anatomy Christmas T Shirt,Tachy Christmas ICU Nurse Tee, Funny Holiday Gift",,https://i.etsystatic.com/6444845164/r/il/35611a/6444845164/il_340x270.6444845164_g7wp.jpg,https://www.etsy.com/listing/1829134995/christmas-cardiac-nurse-comfort-colors?ref=shop_review,13.0,2025-02-18
GONdesignJEWELRY,1811560404,"Wizard Movie Fan Sweatshirt, Wicked Change For Good Crewneck, Popular - LAR T Shirt, Wicked Musical Fan Gift, Magical Wizard Tee",,https://i.etsystatic.com/6428845650/r/il/429c74/6428845650/il_340x270.6428845650_bc38.jpg,https://www.etsy.com/listing/1811560404/wizard-movie-fan-sweatshirt-wicked?ref=shop_review,2.0,2025-02-16
GONdesignJEWELRY,1810108895,"Haynes Sisters White Christmas Movie Comfort Colors Shirt, Sisters Sisters Christmas Song Shirt, Christmas Gifts For Her",,https://i.etsystatic.com/6399158737/r/il/748191/6399158737/il_340x270.6399158737_ot0u.jpg,https://www.etsy.com/listing/1810108895/haynes-sisters-white-christmas-movie?ref=shop_review,17.0,2025-02-15
GONdesignJEWELRY,1745432926,"The Viper Queen Crescent City Comfort Colors Shirt, Crescent City Bookish Fan Shirts, Bryce Quinlan Tee, Gif For Book Lover, Memento Mori",,https://i.etsystatic.com/6115082606/r/il/89ec93/6115082606/il_340x270.6115082606_m6de.jpg,https://www.etsy.com/listing/1745432926/the-viper-queen-crescent-city-comfort?ref=shop_review,2.0,2025-02-15
GONdesignJEWELRY,1829649385,"Wicked Double Sided Sweatshirt, Wizard Movie Fan Crewneck, Wicked Changed For Good TShirt, Wicked The Musical 2 Sided Shirts Hoodie",,https://i.etsystatic.com/6495338633/r/il/8b034a/6495338633/il_340x270.6495338633_5gg8.jpg,https://www.etsy.com/listing/1829649385/wicked-double-sided-sweatshirt-wizard?ref=shop_review,6.0,2025-02-14
GONdesignJEWELRY,1807598965,"Custom Favorite Books Comfort Colors Shirt, All Booked For Christmas T Shirt, Throne Of Glass Christmas Tee, TOG ACOTAR Personalized Shirts",,https://i.etsystatic.com/6385605357/r/il/f47c7c/6385605357/il_340x270.6385605357_tnh8.jpg,https://www.etsy.com/listing/1807598965/custom-favorite-books-comfort-colors?ref=shop_review,2.0,2025-02-14
GONdesignJEWELRY,1741628358,"I Am No Man Comfort Color Shirt, LOTR Shirt, Fantasy Reader TShirt, Eowyn Shirt,  Book Quote Shirt, I Am No Man Tee, Girl Power Shirt",,https://i.etsystatic.com/6145835093/r/il/ebe580/6145835093/il_340x270.6145835093_qazs.jpg,https://www.etsy.com/listing/1741628358/i-am-no-man-comfort-color-shirt-lotr?ref=shop_review,9.0,2025-02-14
GONdesignJEWELRY,1803640248,"Sundays Are For The Birds Comfort Colors Shirt, Game Day Philadelphia T Shirt, Football Season Shirt For Fans, Game Day Football",,https://i.etsystatic.com/6389591292/r/il/94e0a1/6389591292/il_340x270.6389591292_56s7.jpg,https://www.etsy.com/listing/1803640248/sundays-are-for-the-birds-comfort-colors?ref=shop_review,1.0,2025-02-14
GONdesignJEWELRY,1862149203,"Fourth Wing Dragon Mug, Onyx Storm Ceramic Mug, Tairn Andarna Dragon 11oz 15oz Coffee Cups, Onyx Storm Merch, Basgiath War College Mug",,https://i.etsystatic.com/6584817694/r/il/52a0c2/6584817694/il_340x270.6584817694_ria0.jpg,https://www.etsy.com/listing/1862149203/fourth-wing-dragon-mug-onyx-storm?ref=shop_review,1.0,2025-02-13
GONdesignJEWELRY,1821952905,"Fourth Wing Series Comfort Colors Shirt For Fan, Brave The Dark Onyx T Shirt, Dragon Lover Tee, Gift For Book Lover",,https://i.etsystatic.com/6410158352/r/il/5a8a23/6410158352/il_340x270.6410158352_41s5.jpg,https://www.etsy.com/listing/1821952905/fourth-wing-series-comfort-colors-shirt?ref=shop_review,4.0,2025-02-04
GONdesignJEWELRY,1809626627,"Jelly Jubilee Crescent City Coffee Mug, Bryce Quinlan Mug Merch, Crescent City SJM 11oz 15oz Ceramic Mug, Jelly Jubilee Fan Club",,https://i.etsystatic.com/6347624350/r/il/b6b725/6347624350/il_340x270.6347624350_ogiy.jpg,https://www.etsy.com/listing/1809626627/jelly-jubilee-crescent-city-coffee-mug?ref=shop_review,1.0,2025-02-03
